{
  "schema_version": "1.0",
  "event_id": "evt-demo-001",
  "timestamp": "2026-10-20T10:00:00Z",
  "source_product": "suricata",
  "event_type": "alert",
  "asset_id": "asset-web-001",
  "severity": 3,
  "confidence": 0.92,
  "correlation_id": null,
  "src_ip": "192.0.2.25",
  "dest_ip": "198.51.100.20",
  "rule_id": "demo-rule-001",
  "signature": "Synthetic suspicious HTTP pattern",
  "description": "Illustrative security event for contract validation.",
  "raw_ref": "eventstore://demo/evt-demo-001"
}